[
  {
    "state": "WA",
    "county_name": "Adams",
    "county_fips": "53001",
    "ocd_division_id": "ocd-division/country:us/state:wa/county:adams",
    "elections_office_url": "https://wa-adamscounty.civicplus.com/162/Elections-Elecciones",
    "address": "Elections Office, 106 W Main Ave, Ritzville, WA, 99169",
    "phone": "509-659-3249"
  },
  {
    "state": "WA",
    "county_name": "Asotin",
    "county_fips": "53003",
    "ocd_division_id": "ocd-division/country:us/state:wa/county:asotin",
    "elections_office_url": "https://www.co.asotin.wa.us/183/Elections",
    "address": "135 2nd St. / PO Box 129, Asotin, WA, 99402",
    "phone": "509-243-2084"
  },
  {
    "state": "WA",
    "county_name": "Benton",
    "county_fips": "53005",
    "ocd_division_id": "ocd-division/country:us/state:wa/county:benton",
    "elections_office_url": "https://www.bentoncountywa.gov/elections",
    "address": "Mailing Address, PO Box 1000, Richland, WA, 99352",
    "phone": "509-736-3085"
  },
  {
    "state": "WA",
    "county_name": "Chelan",
    "county_fips": "53007",
    "ocd_division_id": "ocd-division/country:us/state:wa/county:chelan",
    "elections_office_url": "http://www.elections.chelancountywa.gov",
    "address": "350 Orondo Ave, Suite 306, Wenatchee, WA, 98801",
    "phone": "509-667-6808"
  },
  {
    "state": "WA",
    "county_name": "Clallam",
    "county_fips": "53009",
    "ocd_division_id": "ocd-division/country:us/state:wa/county:clallam",
    "elections_office_url": "https://www.clallamcountywa.gov/",
    "address": "223 E 4th Street, Ste 1, Port Angeles, WA, 98362",
    "phone": "360-417-2221"
  }
]
